{
  "target": "scanme.example.com",
  "targets": [
    "https://scanme.example.com",
    "api.scanme.example.com"
  ],
  "workspace": "./workspace/scanme",
  "scope": {
    "allowed_domains": ["scanme.example.com"],
    "allow_subdomains": true,
    "allowed_cidrs": [],
    "allow_private": false,
    "allow_wildcard": false,
    "rate_limit": 25,
    "max_concurrency": 5,
    "authorization": "SoW-2026-001 / written permission on file"
  },
  "llm": {
    "provider": "none",
    "model": "",
    "base_url": "",
    "api_key_env": "VAPTR_LLM_API_KEY"
  }
}
